{
  "schema_version": "1.0",
  "event_id": "77777777-7777-4777-8777-777777777777",
  "job_id": "22222222-2222-4222-8222-222222222222",
  "tenant_id": "33333333-3333-4333-8333-333333333333",
  "document_id": "55555555-5555-4555-8555-555555555555",
  "status": "PROCESSING",
  "chunk_count": null,
  "error_message": null
}
